{
  "memory_state_id": "urn:telic:hi6:memory-state:dca6e36e-163a-50f6-8ff9-2f1b7b5288d7",
  "trace": "urn:telic:hi6:trace:19808dfc-8f5e-5d5b-981d-e84b3feed3fd",
  "state": "active_with_conditions",
  "eligible_for_retrieval": true,
  "eligible_for_action": true,
  "eligible_for_training": false,
  "conditions": [
    "valid only until stair repair is witnessed"
  ],
  "valid_time": {
    "valid_from": "2026-07-15T08:00:00Z",
    "valid_to": null
  },
  "review": {
    "trigger": "repair completed or daily inspection"
  },
  "status": "current"
}
